[
  {
    "source_id": "demo_dealer",
    "source_name": "Demo Dealer Feed",
    "external_id": "dd-1001",
    "listing_url": "https://example.com/listings/dd-1001",
    "title": "2022 Toyota Camry LE",
    "description": "Low miles, one owner, NJ.",
    "make": "Toyota",
    "model": "Camry",
    "trim": "LE",
    "year": 2022,
    "body_style": "Sedan",
    "vin": "4T1C11AK5NU123456",
    "mileage": 18500,
    "mileage_unit": "mi",
    "price_amount": 24500,
    "currency": "USD",
    "seller_name": "Demo Motors",
    "seller_type": "dealer",
    "latitude": 40.72,
    "longitude": -74.17,
    "region": "NJ",
    "city": "Newark",
    "postal_code": "07102",
    "listing_updated_at": "2026-05-01T12:00:00+00:00",
    "scraped_at": "2026-05-05T18:00:00+00:00"
  },
  {
    "source_id": "demo_dealer",
    "source_name": "Demo Dealer Feed",
    "external_id": "dd-1002",
    "listing_url": "https://example.com/listings/dd-1002",
    "title": "2021 Honda CR-V EX",
    "description": "AWD, single owner.",
    "make": "Honda",
    "model": "CR-V",
    "trim": "EX",
    "year": 2021,
    "body_style": "SUV",
    "vin": "2HKRW2H51MH789012",
    "mileage": 32000,
    "mileage_unit": "mi",
    "price_amount": 28900,
    "currency": "USD",
    "seller_name": "Demo Motors",
    "seller_type": "dealer",
    "latitude": 40.65,
    "longitude": -73.95,
    "region": "NJ",
    "city": "Jersey City",
    "postal_code": "07302",
    "listing_updated_at": "2026-05-03T09:30:00+00:00",
    "scraped_at": "2026-05-05T18:00:00+00:00"
  },
  {
    "source_id": "other_feed",
    "source_name": "Other Feed",
    "external_id": "of-2044",
    "listing_url": "https://example.org/cars/of-2044",
    "title": "2022 Toyota Camry LE — alt",
    "description": "Same car, duplicate listing from another source.",
    "make": "Toyota",
    "model": "Camry",
    "trim": "LE",
    "year": 2022,
    "body_style": "Sedan",
    "vin": "4T1C11AK5NU123456",
    "mileage": 18500,
    "mileage_unit": "mi",
    "price_amount": 24400,
    "currency": "USD",
    "seller_type": "dealer",
    "region": "NJ",
    "listing_updated_at": "2026-05-04T10:00:00+00:00",
    "scraped_at": "2026-05-05T19:00:00+00:00"
  }
]
